deal_id,deal_title,deal_url,deal_rating,deal_rating_count,deal_mrp_price,deal_act_price,deal_offer_percent,deal_offer_price,top_offers,category_1,category_2,category_3,category_4,category_5,category_6,category_7,category_all,product_description,top_customer_reviews,Unnamed: 20,Unnamed: 21,Unnamed: 22,Unnamed: 23,Unnamed: 24,Unnamed: 25,Unnamed: 26,Unnamed: 27,Unnamed: 28,Unnamed: 29,Unnamed: 30,Unnamed: 31,Unnamed: 32,Unnamed: 33,Unnamed: 34,Unnamed: 35,Unnamed: 36,Unnamed: 37,Unnamed: 38,Unnamed: 39,Unnamed: 40,Unnamed: 41,Unnamed: 42,Unnamed: 43,Unnamed: 44,Unnamed: 45,Unnamed: 46,Unnamed: 47,Unnamed: 48,Unnamed: 49,Unnamed: 50,Unnamed: 51,Unnamed: 52,Unnamed: 53,Unnamed: 54
459,"RPM Euro Games Wireless Gaming Mouse | Rechageable 500 mAh Battery | Adjustable 2400 DPI | 6 Color Backlit RGB | Works with Windows, MAC, Android.",https://www.amazon.in/RPM-Euro-Games-Rechargeable-Adjustable/dp/B0BNVKL742/ref=sr_1_10?dib=eyJ2IjoiMSJ9.QvxeiTZ9MiFBf711WI9mrrIxMDENto8U7sS3Azx6QxkUA_ScGHu1rc_N_aOUZpdXN18ilX78mk4GyBPpduiCKjdDHn8H1SJSHr-VG6UNsUJN1CWFjsGpzL3BGRK1bjZYRcgjzY8E-XthlSBJkhFCGkxHtFmWQafxhuEs5qjtsD3EbHj5h6Ot0NioQo-HHuSnd2JI9M8CUR7MUQtcZE18w3112esF0SAKkoGoAmWgrRQPeU88Dyot5IeHQp0BZXT1e07nnGw8-JdlZwOlqSpUpBVkqBppAzfhyLxxr310ukk.Z7iN48W_6Hxg2r6cB8t_N3D8Zr7ObQu4KZr_ot-dct0&dib_tag=se&qid=1716234586&refinements=p_72%3A1318476031&rnid=1318475031&s=computers&sr=1-10,4,548,990,499,50,491,[],Computers & Accessories,Accessories & Peripherals,PC Gaming Peripherals,Gaming Mice,,,,"['Computers & Accessories', 'Accessories & Peripherals', 'PC Gaming Peripherals', 'Gaming Mice']","【RECHARGEABLE & PORTABLE】Built-in 500mAh rechargeable battery, easy charging by included USB cable. Adopt intelligent energy-saving design, standby time is long with auto sleep mode. 【Upto 2400 DPI】- It gives you multiple choices to set the sensitivity parameters suiting your style in best way from 800-1600-2400 DPI. 【6-COLOR LED LIGHT】6 different colors LED light that changes while in use, makes your mouse multi-colored and cool colorful.(Note: LED lights change colors automatically, and will not stay in one color, it will change regularly with 6 colors. 【NO EXTERNAL BATTERY】- RPM Euro Games wireless mouse has an in-built Rechargeable Li-ion battery and does not require any external battery. Once the battery drains you can play it in wired connection simultaneously charging the mouse, hence there is no wait time for charging it differently or waiting to get new batteries. Plug & play with Auto-Sleep Feature : Integrated time-sensing technology will automatically place your mouse in sleep mode if it is left idle. 【DUAL GAMING MODE】- Advanced gaming grade 2.4 Wireless connection or micro usb cord wired connection experience zero delay between your thoughts and actions.",,,,,,,,,,,,,,,,,,,,,,,,,,,,,,,,,,,,
460,"HyperX Pulsefire Haste USB Gaming Mouse Ultra Lightweight, 59g, Hex Design, Honeycomb Shell, Hyperflex Cable, Up to 16000 DPI, 6 Programmable Buttons (4P5E3AA)- Black, Red",https://www.amazon.in/HyperX-Pulsefire-Haste-Lightweight-Programmable/dp/B09QX54293/ref=sr_1_22?dib=eyJ2IjoiMSJ9.QvxeiTZ9MiFBf711WI9mrrIxMDENto8U7sS3Azx6QxkUA_ScGHu1rc_N_aOUZpdXN18ilX78mk4GyBPpduiCKjdDHn8H1SJSHr-VG6UNsUJN1CWFjsGpzL3BGRK1bjZYRcgjzY8E-XthlSBJkhFCGkxHtFmWQafxhuEs5qjtsD3EbHj5h6Ot0NioQo-HHuSnd2JI9M8CUR7MUQtcZE18w3112esF0SAKkoGoAmWgrRQPeU88Dyot5IeHQp0BZXT1e07nnGw8-JdlZwOlqSpUpBVkqBppAzfhyLxxr310ukk.Z7iN48W_6Hxg2r6cB8t_N3D8Zr7ObQu4KZr_ot-dct0&dib_tag=se&qid=1716234586&refinements=p_72%3A1318476031&rnid=1318475031&s=computers&sr=1-22,4.5,8288,5057,3559,30,1498,"['Upto ₹160.24 EMI interest savings on Amazon Pay ICICI Bank Credit CardsUpto ₹160.24 EMI interest savings on Amazon Pay ICICI…', 'Upto ₹2,000.00 discount on select Credit CardsUpto ₹2,000.00 discount on select Credit Cards', 'Get GST invoice and save up to 28% on business purchases. Sign up for freeGet GST invoice and save up to 28% on business purchases.']",Computers & Accessories,Accessories & Peripherals,PC Gaming Peripherals,Gaming Mice,,,,"['Computers & Accessories', 'Accessories & Peripherals', 'PC Gaming Peripherals', 'Gaming Mice']","Ultra-light hex shell design: The honeycomb shell provides feather-light weight without sacrificing durability. HyperFlex USB Cable: The light, flexible paracord material reduces tension and resistance for easier mouse movement. TTC Golden micro dustproof switches: These switches provide solid, satisfying clicks and are rated for 60 million clicks. Pure virgin-grade PTFE skates: The low-friction 100% PTFE skates help provide an easy, effortless glide. Grip tape included: For more control and comfort, grip tape for the sides and left and right buttons are included. Customizable with HyperX NGENUITY Software: Easily customize with the powerful, easy-to-use, HyperX NGENUITY Software.",,,,,,,,,,,,,,,,,,,,,,,,,,,,,,,,,,,,
463,"Cosmic Byte Kilonova 3335IC Wireless + Wired Dual Mode RGB Gaming Mouse with Pixart 3335 Sensor, Ultra Lightweight 89grams,Rechargeable 400mAh Battery, Replaceable Top Cover and Side Buttons (Black)",https://www.amazon.in/Cosmic-Byte-Kilonova-3335IC-Rechargeable/dp/B09G88WR3W/ref=sr_1_18?dib=eyJ2IjoiMSJ9.QvxeiTZ9MiFBf711WI9mrrIxMDENto8U7sS3Azx6QxkUA_ScGHu1rc_N_aOUZpdXN18ilX78mk4GyBPpduiCKjdDHn8H1SJSHr-VG6UNsUJN1CWFjsGpzL3BGRK1bjZYRcgjzY8E-XthlSBJkhFCGkxHtFmWQafxhuEs5qjtsD3EbHj5h6Ot0NioQo-HHuSnd2JI9M8CUR7MUQtcZE18w3112esF0SAKkoGoAmWgrRQPeU88Dyot5IeHQp0BZXT1e07nnGw8-JdlZwOlqSpUpBVkqBppAzfhyLxxr310ukk.Z7iN48W_6Hxg2r6cB8t_N3D8Zr7ObQu4KZr_ot-dct0&dib_tag=se&qid=1716234586&refinements=p_72%3A1318476031&rnid=1318475031&s=computers&sr=1-18,4.3,899,3899,3079,21,820,"['Upto ₹138.62 EMI interest savings on Amazon Pay ICICI Bank Credit CardsUpto ₹138.62 EMI interest savings on Amazon Pay ICICI…', 'Upto ₹2,000.00 discount on select Credit CardsUpto ₹2,000.00 discount on select Credit Cards', 'Get GST invoice and save up to 28% on business purchases. Sign up for freeGet GST invoice and save up to 28% on business purchases.']",Computers & Accessories,Accessories & Peripherals,PC Gaming Peripherals,Gaming Mice,,,,"['Computers & Accessories', 'Accessories & Peripherals', 'PC Gaming Peripherals', 'Gaming Mice']","Ambidextrous Design-Symmetrical in shape making it suitable for both right and left-handed users. Lightweight Multi-hole Honeycomb Design- At just 89 grams, you can shoot and flick faster. 10 Button Mouse- 7 Programmable Buttons- Assign macros and functions through software to each button 1.8M Paracord cable- Ultra lightweight and flexible “Feels like Wireless”. Dual Mode: Use the mouse as wired or wireless dual mode. Just plug in the mouse to the PC using the included cable and use in wired mode and charge the battery at the same time. Plug in the Wireless Dongle to use in wireless mode.",,,,,,,,,,,,,,,,,,,,,,,,,,,,,,,,,,,,
464,"Cosmic Byte CB-GK-37 Firefly Per-Key RGB TKL Mechanical Keyboard with Swappable Outemu Red Switch, Macros, Software (White)",https://www.amazon.in/Cosmic-Byte-Firefly-Mechanical-Swappable/dp/B0BTD484S1/ref=sr_1_14?dib=eyJ2IjoiMSJ9.QvxeiTZ9MiFBf711WI9mrrIxMDENto8U7sS3Azx6QxkUA_ScGHu1rc_N_aOUZpdXN18ilX78mk4GyBPpduiCKjdDHn8H1SJSHr-VG6UNsUJN1CWFjsGpzL3BGRK1bjZYRcgjzY8E-XthlSBJkhFCGkxHtFmWQafxhuEs5qjtsD3EbHj5h6Ot0NioQo-HHuSnd2JI9M8CUR7MUQtcZE18w3112esF0SAKkoGoAmWgrRQPeU88Dyot5IeHQp0BZXT1e07nnGw8-JdlZwOlqSpUpBVkqBppAzfhyLxxr310ukk.Z7iN48W_6Hxg2r6cB8t_N3D8Zr7ObQu4KZr_ot-dct0&dib_tag=se&qid=1716234586&refinements=p_72%3A1318476031&rnid=1318475031&s=computers&sr=1-14,4.3,6223,6999,3299,53,3700,"['Upto ₹148.58 EMI interest savings on Amazon Pay ICICI Bank Credit CardsUpto ₹148.58 EMI interest savings on Amazon Pay ICICI…', 'Upto ₹2,000.00 discount on select Credit CardsUpto ₹2,000.00 discount on select Credit Cards', 'Get GST invoice and save up to 28% on business purchases. Sign up for freeGet GST invoice and save up to 28% on business purchases.']",Computers & Accessories,Accessories & Peripherals,PC Gaming Peripherals,Gaming Keyboards,,,,"['Computers & Accessories', 'Accessories & Peripherals', 'PC Gaming Peripherals', 'Gaming Keyboards']","Enhance your gaming experience with 18 preset configurations on mechanical keyboard and find a unique one to match your own system. The Firefly comes with customized Outemu Red Mechanical switches to ensure best quality and are equipped with optical sensors for precise gaming and comfortable typing. Textured and contoured keycaps provide maximum grip and enhanced feel. No matter how fast your in-game actions are, every key press registers correctly. The compact design of the keyboard takes up minimum tablespace for a neater and cleaner workstation. With keycaps leaning backward and forward design to make the typing more comfortable, the fold-out legs allows you to choose the best typing height.",,,,,,,,,,,,,,,,,,,,,,,,,,,,,,,,,,,,
466,Cosmic Byte CB-GK-27 Vanth Mechanical Keyboard Upgraded with Swappable Outemu Blue Switches and Rainbow LED (Black/Grey),https://www.amazon.in/Cosmic-Byte-CB-GK-27-Mechanical-Keyboard/dp/B09MQZY875/ref=sr_1_12?dib=eyJ2IjoiMSJ9.QvxeiTZ9MiFBf711WI9mrrIxMDENto8U7sS3Azx6QxkUA_ScGHu1rc_N_aOUZpdXN18ilX78mk4GyBPpduiCKjdDHn8H1SJSHr-VG6UNsUJN1CWFjsGpzL3BGRK1bjZYRcgjzY8E-XthlSBJkhFCGkxHtFmWQafxhuEs5qjtsD3EbHj5h6Ot0NioQo-HHuSnd2JI9M8CUR7MUQtcZE18w3112esF0SAKkoGoAmWgrRQPeU88Dyot5IeHQp0BZXT1e07nnGw8-JdlZwOlqSpUpBVkqBppAzfhyLxxr310ukk.Z7iN48W_6Hxg2r6cB8t_N3D8Zr7ObQu4KZr_ot-dct0&dib_tag=se&qid=1716234586&refinements=p_72%3A1318476031&rnid=1318475031&s=computers&sr=1-12,4.2,1152,3299,1846,44,1453,"['Upto ₹83.10 EMI interest savings on Amazon Pay ICICI Bank Credit CardsUpto ₹83.10 EMI interest savings on Amazon Pay ICICI…', 'Upto ₹2,000.00 discount on select Credit CardsUpto ₹2,000.00 discount on select Credit Cards', 'Get GST invoice and save up to 28% on business purchases. Sign up for freeGet GST invoice and save up to 28% on business purchases.']",Computers & Accessories,Accessories & Peripherals,PC Gaming Peripherals,Gaming Keyboards,,,,"['Computers & Accessories', 'Accessories & Peripherals', 'PC Gaming Peripherals', 'Gaming Keyboards']",Full Size Mechanical Keyboard with 104 keys.FN+SCRLK can switch : 6 keys anti-ghosting and full keys anti-ghosting Blue Outemu Mechanical Key Switches. 50 million + Operations for Each Key. Injection Molded Double-shot Color Keycaps. Simultaneous Operation for All Keys Without Any Key Ghosting Effects. Adjustable Backlight Brightness and Speed 20 Backlight Effects and 8 Game Modes,,,,,,,,,,,,,,,,,,,,,,,,,,,,,,,,,,,,
