deal_id,deal_title,deal_url,deal_rating,deal_rating_count,deal_mrp_price,deal_act_price,deal_offer_percent,deal_offer_price,top_offers,category_1,category_2,category_3,category_4,category_5,category_6,category_7,category_all,product_description,top_customer_reviews,Unnamed: 20,Unnamed: 21,Unnamed: 22,Unnamed: 23,Unnamed: 24,Unnamed: 25,Unnamed: 26,Unnamed: 27,Unnamed: 28,Unnamed: 29,Unnamed: 30,Unnamed: 31,Unnamed: 32,Unnamed: 33,Unnamed: 34,Unnamed: 35,Unnamed: 36,Unnamed: 37,Unnamed: 38,Unnamed: 39,Unnamed: 40,Unnamed: 41,Unnamed: 42,Unnamed: 43,Unnamed: 44,Unnamed: 45,Unnamed: 46,Unnamed: 47,Unnamed: 48,Unnamed: 49,Unnamed: 50,Unnamed: 51,Unnamed: 52,Unnamed: 53,Unnamed: 54
52,MI Power Bank 3i 20000mAh Lithium Polymer 18W Fast Power Delivery Charging | Input- Type C | Micro USB| Triple Output | Black.,https://www.amazon.in/20000mAh-Sandstone-Triple-Charging-Delivery/dp/B08HV83HL3/ref=sr_1_10?dib=eyJ2IjoiMSJ9.xIAnZhWhGc42wk6MqmMWryLb_cT_UQunxC50ABPIRelDmVy8GPU5_yyt5pju5yFd5GdFnqKqd9O4vKfHYU2OyG0Z0S7EQfqopFkOc6tKi7XMMNwy_FbAxSEYroR7aMwkvIkr_8A1vPTDhCLhpNjpMNuxGXhZm6UgA0ntRzbW4ZxA9Wr7HFqAyoxMUdOaC8tKa4Viy1ICp8dNts9dh1GTvh73Wkp0VVGVdyTNqHzy-JVcSmQTUUQY1qJlYGuq05qLfT5KqP_ds8Fs7tmsBSB9c_36fwIRbM7IV9mil9NMyc8.gYz68lu8lnNvnX5dDVRzGFNTbZ_6rXCq0x8Wj2VwjuQ&dib_tag=se&qid=1715407693&refinements=p_72%3A1318476031&rnid=1318475031&s=electronics&sr=1-10,4.2,158778,2199,2149,2,50,"['Upto ₹96.75 EMI interest savings on Amazon Pay ICICI Bank Credit CardsUpto ₹96.75 EMI interest savings on Amazon Pay ICICI…', 'Upto ₹1,500.00 discount on select Credit Cards, HDFC Bank Debit CardsUpto ₹1,500.00 discount on select Credit Cards, HDFC…', 'Get GST invoice and save up to 28% on business purchases. Sign up for freeGet GST invoice and save up to 28% on business purchases.']",Electronics,Mobiles & Accessories,Mobile Accessories,Chargers,Power Banks,,,"['Electronics', 'Mobiles & Accessories', 'Mobile Accessories', 'Chargers', 'Power Banks']","20000mAh Lithium Polymer battery 18W Fast Charging Triple port output Dual input port (Micro-USB/USB-C, Charging Time : 6.9 hours Power Delivery Advanced 12 Layer chip protection Smart power management 6 months domestic warranty",,,,,,,,,,,,,,,,,,,,,,,,,,,,,,,,,,,,
65,Portronics Luxcell Wireless Mini 10k 10000mAh 15W Magnetic Wireless Fast Charging Smallest Power Bank with 22.5 Wired Output Compatible with iPhone 12 & Above & Other QI Enabled Devices(Black),https://www.amazon.in/Portronics-Wireless-10000mAh-Magnetic-Compatible/dp/B0CRVQC189/ref=sr_1_11?dib=eyJ2IjoiMSJ9.f1CDQrdL6WIsNU9QVa9kRWYy_8ida58ZwjDpYvnF4Nzz_egKGxcPZlongZ3KBLrOLv-l7kDsUAnPKaiP8Nt0C5FPxK8Y3OLcBh4aYkWyAiyC9IbeEKR0PbmAiqLrE1GgxKlnI60_aGASULnpfyyufrBy-VLRiUQ5W96IeWoL0klmU_x-f1KQHdttXTtg_O2-1c7Bxeu3xL1DmaecnEdSPY1XWItKSale0yc3MwiS7AIJEEORoQT-dX9wiu7n5wvF7Iq17lZgsqnxTEKzEJamaZajoHB4uqZu4RvkGSF425Q.hnnyAPUjx4ZAhD1LL-0-xcqy-qVhh4IjdyY0nftbTjk&dib_tag=se&qid=1716053411&refinements=p_72%3A1318476031&rnid=1318475031&s=electronics&sr=1-11,4,537,3999,1499,63,2500,[],Electronics,Mobiles & Accessories,Mobile Accessories,Chargers,Power Banks,,,"['Electronics', 'Mobiles & Accessories', 'Mobile Accessories', 'Chargers', 'Power Banks']","MagSafe Wireless Charging: Portronics Luxcell Wireless Mini 10K supports 15W Magsafe (wireless) charging for QI-enabled devices (iPhone- 12 and above, Samsung S series, etc). 22.5W Smallest Power Bank: This smallest 10,000mAh Lithium Polymer battery power bank delivers a rapid 22.5W maximum output, guaranteeing you'll never run out of battery again. Stay charged on the go! Dual Port Fast Charge: This fast charging power bank offers you Fast charging via Type C PD Port and USB MACH port, so you can charge multiple devices at one time. Refuel the power bank via the Type C port. Luxury Charging Solution: Glam up your charging routine with Luxcell Wireless Power Bank, which combines lasting performance with stunning aesthetics. Get a complementary Type C to Type C cable as a bonus! LED Battery Indicator: This 10000 mAh Fast charging Power bank has a transparent plastic casing with an LED indicator, keeping you informed about the power bank and your device’s charge. Broad Compatibility: Luxcell Wireless Mini 10K, PD Power Bank is compatible with smartphones, tablets, earbuds, neckbands, speakers, smartwatches, and other USB-powered devices. It can charge an iPhone 14 battery up to 45% in an hour. Sleek and Compact Body: Its ultra-compact body and fine touch finish give it a premium look. Apart from being powerful, it fits effortlessly into your bag or pocket, making it the ideal travel companion.",,,,,,,,,,,,,,,,,,,,,,,,,,,,,,,,,,,,
72,"MI 10000mAh Lithium Ion, Lithium Polymer Power Bank Pocket Pro with 22.5 Watt Fast Charging, Dual Input Ports(Micro-USB and Type C), Triple Output Ports, (Black)",https://www.amazon.in/Pocket-10000mAh-Triple-Charging-Delivery/dp/B08MC57J31/ref=sr_1_21?dib=eyJ2IjoiMSJ9.f1CDQrdL6WIsNU9QVa9kRWYy_8ida58ZwjDpYvnF4Nzz_egKGxcPZlongZ3KBLrOLv-l7kDsUAnPKaiP8Nt0C5FPxK8Y3OLcBh4aYkWyAiyC9IbeEKR0PbmAiqLrE1GgxKlnI60_aGASULnpfyyufrBy-VLRiUQ5W96IeWoL0klmU_x-f1KQHdttXTtg_O2-1c7Bxeu3xL1DmaecnEdSPY1XWItKSale0yc3MwiS7AIJEEORoQT-dX9wiu7n5wvF7Iq17lZgsqnxTEKzEJamaZajoHB4uqZu4RvkGSF425Q.hnnyAPUjx4ZAhD1LL-0-xcqy-qVhh4IjdyY0nftbTjk&dib_tag=se&qid=1716053411&refinements=p_72%3A1318476031&rnid=1318475031&s=electronics&sr=1-21,4.3,21673,2699,1699,37,1000,"['Upto ₹76.48 EMI interest savings on Amazon Pay ICICI Bank Credit CardsUpto ₹76.48 EMI interest savings on Amazon Pay ICICI…', 'Upto ₹2,000.00 discount on select Credit Cards, HDFC Bank Debit CardsUpto ₹2,000.00 discount on select Credit Cards, HDF…', 'Get GST invoice and save up to 28% on business purchases. Sign up for freeGet GST invoice and save up to 28% on business purchases.']",Electronics,Mobiles & Accessories,Mobile Accessories,Chargers,Power Banks,,,"['Electronics', 'Mobiles & Accessories', 'Mobile Accessories', 'Chargers', 'Power Banks']",22.5W Ultra Fast Charging Super light-weight and Pocket sized Power delivery 3.0 Charging time - 6 hours,,,,,,,,,,,,,,,,,,,,,,,,,,,,,,,,,,,,
104,"Mi 10000mAH Li-Polymer, Micro-USB and Type C Input Port, Power Bank 3i with 18W Fast Charging (Midnight Black)",https://www.amazon.in/10000mAH-Li-Polymer-Power-Charging-Midnight/dp/B08HVL8QN3/ref=sr_1_23?dib=eyJ2IjoiMSJ9.f1CDQrdL6WIsNU9QVa9kRWYy_8ida58ZwjDpYvnF4Nzz_egKGxcPZlongZ3KBLrOLv-l7kDsUAnPKaiP8Nt0C5FPxK8Y3OLcBh4aYkWyAiyC9IbeEKR0PbmAiqLrE1GgxKlnI60_aGASULnpfyyufrBy-VLRiUQ5W96IeWoL0klmU_x-f1KQHdttXTtg_O2-1c7Bxeu3xL1DmaecnEdSPY1XWItKSale0yc3MwiS7AIJEEORoQT-dX9wiu7n5wvF7Iq17lZgsqnxTEKzEJamaZajoHB4uqZu4RvkGSF425Q.hnnyAPUjx4ZAhD1LL-0-xcqy-qVhh4IjdyY0nftbTjk&dib_tag=se&qid=1716053411&refinements=p_72%3A1318476031&rnid=1318475031&s=electronics&sr=1-23,4.2,159088,2199,1199,45,1000,[],Electronics,Mobiles & Accessories,Mobile Accessories,Chargers,Power Banks,,,"['Electronics', 'Mobiles & Accessories', 'Mobile Accessories', 'Chargers', 'Power Banks']",Warranty : 6 months domestic warranty It can be a gift option Best-in class specs,,,,,,,,,,,,,,,,,,,,,,,,,,,,,,,,,,,,
206,"Ambrane 10000mAh Rugged, Slim & Compact Powerbank, 22.5W Fast Charging, USB & Type C Output, Power Delivery, Quick Charge for iPhone, Android & Other Devices (Force 10k, Purple)",https://www.amazon.in/Ambrane-10000mAh-Powerbank-Charging-Delivery/dp/B0CTQ9CZ1N/ref=sr_1_14?dib=eyJ2IjoiMSJ9.MHNFOkyqj10Gff_Vww3O46ijIHTK1w8r0CPGIt9JigzrMlKZwmtWBoZqs112iVYpKF8b5PkaLpLs9Lb24Mul_Yr-oWUtbPv4XUQgbEZRfjr4g0sFL-IEv3eZj_-B_eBpsjZt2nhJf017djXDqqU1nagQdoy2H-OctvfWYcnmlXiLciMNE7n5unasS5VcSrGYZ2n1hRoaJhfIqvQsmgd_YqSURzlGOBOvan1CpUEmo0P3wnpXOI8ud6TMPAzECi9XLbDf96zr6-eP4DAGDHY9QeeafxHctQlNly95ZY_CuyI.AkIiRyy-01xoXvLqBVLu4UFGEq1jqsdErPSSpxD6YY4&dib_tag=se&qid=1716059976&refinements=p_72%3A1318476031&rnid=1318475031&s=electronics&sr=1-14,4.1,632,2999,1399,53,1600,[],Electronics,Mobiles & Accessories,Mobile Accessories,Chargers,Power Banks,,,"['Electronics', 'Mobiles & Accessories', 'Mobile Accessories', 'Chargers', 'Power Banks']","10000mAh Powerbank: Delivers high-capacity charging with BoostedSpeed technology, ensuring your devices stay powered up during your adventures. Compact Size, Rugged Design: Portable and durable, its rugged aesthetics and compact form factor make it adventure-ready, fitting seamlessly into your backpack or pocket. 22.5W BoostedSpeed: This powerbank offers a maximum output of 22.5W for efficient and rapid charging. 20W Input: Supports fast charging with up to 20W input. Dual Output: 2 ports (1 Type-C & 1 USB-A) for simultaneous charging of multiple devices. Multi Layers of Chipset Protection: Equipped with overcharge protection, short circuit protection, temperature resistance, and a reset mechanism, ensuring safe and stable charging for your devices. Lightweight: Lightweight yet robust, making it easy to carry during your outdoor activities. Smart Power Management: Efficiently manages power distribution for stable output, ensuring your devices charge optimally. Perfect for VOOC, WARP & DASH Smartphones: This charger is fully compatible with VOOC, WARP and DASH protocol-supported smartphones, delivering rapid and optimized charging.",,,,,,,,,,,,,,,,,,,,,,,,,,,,,,,,,,,,
207,"pTron Newly Launched Dynamo Surge 20000mAh 22.5W Fast Charging Power Bank, Supports VOOC/Wrap/Dash USB Charging, 20W PD Fast Charging, 3 Outputs, 1 Input & Multiple Layers of Protection (Blue)",https://www.amazon.in/pTron-Launched-Dynamo-Surge-Protection/dp/B0CZ4BLF8W/ref=sr_1_15?dib=eyJ2IjoiMSJ9.MHNFOkyqj10Gff_Vww3O46ijIHTK1w8r0CPGIt9JigzrMlKZwmtWBoZqs112iVYpKF8b5PkaLpLs9Lb24Mul_Yr-oWUtbPv4XUQgbEZRfjr4g0sFL-IEv3eZj_-B_eBpsjZt2nhJf017djXDqqU1nagQdoy2H-OctvfWYcnmlXiLciMNE7n5unasS5VcSrGYZ2n1hRoaJhfIqvQsmgd_YqSURzlGOBOvan1CpUEmo0P3wnpXOI8ud6TMPAzECi9XLbDf96zr6-eP4DAGDHY9QeeafxHctQlNly95ZY_CuyI.AkIiRyy-01xoXvLqBVLu4UFGEq1jqsdErPSSpxD6YY4&dib_tag=se&qid=1716059976&refinements=p_72%3A1318476031&rnid=1318475031&s=electronics&sr=1-15,4.1,477,3999,1399,65,2600,[],Electronics,Mobiles & Accessories,Mobile Accessories,Chargers,Power Banks,,,"['Electronics', 'Mobiles & Accessories', 'Mobile Accessories', 'Chargers', 'Power Banks']","The pTron Dynamo Surge 20000mAh power bank stands out as a portable powerhouse equipped with dual USB and PD/Type-C outputs, ensuring high-speed charging for your devices during your busiest and longest days. With a fast-charging USB input option (Type-C/PD), the power bank features two USB ports, providing versatile and efficient charging methods. The 20000mAh large capacity enhances durability and optimizes charging efficiency, delivering a constant power supply to each connected device. Encased in a robust hard ABS shell, this power bank incorporates multiple protective functions, including Overcharge Protection, Over-Discharge Protection, Over Current Protection, Over Voltage Protection, and Short Circuit Protection, ensuring extended service life. The power bank adopts a premium Li-polymer battery cell and achieves a full charge in approximately 8-9 hours. It caters to a diverse range of electronic needs and is compatible with smartphones, tablets, digital cameras, and handheld gaming devices. Additional specifications include Input Type-C: 5V/3A, 9V/2A | Output Type-C: 5V/3A, 9V/2.22A 12V/1.65A (20W max.) | USB-1 Output: 5V/3A, 9V/2.22A, 12V/1.65A, 10V/2.25A | USB-2 Output: 5V/3A, 9V/2.22A, 12V/1.65A, 10V/2.25A (22.5W max.). Backed by a 1-year manufacturer warranty covering manufacturing defects only, customer support can be reached at 040-67138888 or via email at support@ptron.in.",,,,,,,,,,,,,,,,,,,,,,,,,,,,,,,,,,,,
208,"Duracell Power Bank 10000 mAh, Portable Charger, USB C/Micro USB Input, USB A/USB C Output, Fast Charge Technology, 22.5W Power Delivery for Smartphones, Tablets, Headphones and USB-Powered Devices",https://www.amazon.in/Duracell-Technology-Smartphones-Headphones-USB-Powered/dp/B0BJV59X3P/ref=sr_1_13?dib=eyJ2IjoiMSJ9.MHNFOkyqj10Gff_Vww3O46ijIHTK1w8r0CPGIt9JigzrMlKZwmtWBoZqs112iVYpKF8b5PkaLpLs9Lb24Mul_Yr-oWUtbPv4XUQgbEZRfjr4g0sFL-IEv3eZj_-B_eBpsjZt2nhJf017djXDqqU1nagQdoy2H-OctvfWYcnmlXiLciMNE7n5unasS5VcSrGYZ2n1hRoaJhfIqvQsmgd_YqSURzlGOBOvan1CpUEmo0P3wnpXOI8ud6TMPAzECi9XLbDf96zr6-eP4DAGDHY9QeeafxHctQlNly95ZY_CuyI.AkIiRyy-01xoXvLqBVLu4UFGEq1jqsdErPSSpxD6YY4&dib_tag=se&qid=1716059976&refinements=p_72%3A1318476031&rnid=1318475031&s=electronics&sr=1-13,4.1,1237,2499,1799,28,700,"['Upto ₹81.03 EMI interest savings on Amazon Pay ICICI Bank Credit CardsUpto ₹81.03 EMI interest savings on Amazon Pay ICICI…', 'Upto ₹2,000.00 discount on select Credit Cards, HDFC Bank Debit CardsUpto ₹2,000.00 discount on select Credit Cards, HDFC…', 'Get GST invoice and save up to 28% on business purchases. Sign up for freeGet GST invoice and save up to 28% on business purchases.']",Electronics,Mobiles & Accessories,Mobile Accessories,Chargers,Power Banks,,,"['Electronics', 'Mobiles & Accessories', 'Mobile Accessories', 'Chargers', 'Power Banks']","Duracell Power Bank 10000 mAh, Portable Charger, USB C/Micro USB Input, USB A/USB C output, Fast Charge Technology, 22.5W Power Delivery for Smartphones, Tablets, Headphones and USB-Powered Devices",,,,,,,,,,,,,,,,,,,,,,,,,,,,,,,,,,,,
209,"Portronics Luxcell B 10K 10000 mAh 22.5W Fast Charging Power Bank, Ultra Slim Power Bank with Mach USB-A Output, Type C PD Output, Type C Input, Wake Up Button(Dark Blue)",https://www.amazon.in/Portronics-Luxcell-Charging-Output-Button/dp/B0CQK43DGH/ref=sr_1_18?dib=eyJ2IjoiMSJ9.MHNFOkyqj10Gff_Vww3O46ijIHTK1w8r0CPGIt9JigzrMlKZwmtWBoZqs112iVYpKF8b5PkaLpLs9Lb24Mul_Yr-oWUtbPv4XUQgbEZRfjr4g0sFL-IEv3eZj_-B_eBpsjZt2nhJf017djXDqqU1nagQdoy2H-OctvfWYcnmlXiLciMNE7n5unasS5VcSrGYZ2n1hRoaJhfIqvQsmgd_YqSURzlGOBOvan1CpUEmo0P3wnpXOI8ud6TMPAzECi9XLbDf96zr6-eP4DAGDHY9QeeafxHctQlNly95ZY_CuyI.AkIiRyy-01xoXvLqBVLu4UFGEq1jqsdErPSSpxD6YY4&dib_tag=se&qid=1716059976&refinements=p_72%3A1318476031&rnid=1318475031&s=electronics&sr=1-18,4.2,284,1799,799,56,1000,[],Electronics,Mobiles & Accessories,Mobile Accessories,Chargers,Power Banks,,,"['Electronics', 'Mobiles & Accessories', 'Mobile Accessories', 'Chargers', 'Power Banks']","22.5W High-Capacity Performance: Portronics’ Luxcell B 10,000mAh power bank allows multiple device charges, while its 22.5W max output provides ultra-fast charging for smartphones, tablets, and other USB devices. Luxury Charging Solution: Make a style statement with the portable Power Bank's luxurious design and four stunning color variants. Fast charging meets elegant design for a truly smart power solution. Dual Port Fast Charging: Dual ports – a Mach USB A (22.5W) and Type-C PD 3.0 (20W), allow dual device fast charging. The Type C port serves as both output and input, ensuring efficient power for your devices on the go. LED Battery Indicator: This fast charging Power bank has an LED battery indicator, informing you about the power bank and your device’s charge. Get a complementary cable to charge the power bank and your devices. Universal Device Charging: This durable power bank 10,000mAh ensures maximum efficiency in charging Android smartphones, iPhones, tablets, Bluetooth headphones, speakers, and other USB-A and USB-C devices. Slimmest Power Bank: Luxcell B’s compact & lightweight body makes it a travel essential. Ideal for on-the-go charging, it easily fits in your pocket or bag, so you stay powered up wherever you are- be it work, travel, or home. Safe Charging: With multiple layers of advanced circuit protection, our BIS-certified 10000 mah Fast charging power bank ensures safety against overcharging, overheating, and short circuits. Warranty: The Luxcell B slim power bank is proudly Made in India. It comes with a 1 year warranty against manufacturing defects. Invest in reliability, backed by our commitment to quality.",,,,,,,,,,,,,,,,,,,,,,,,,,,,,,,,,,,,
210,"boAt Energyshroom PB300 Powerbank with 10000mAh Battery, 22.5w Fast Charging, 12-Layer Smart IC Protection, LED Indicators and Aluminum Alloy Casing(Carbon Black)",https://www.amazon.in/boAt-Energyshroom-PB300-Protection-Indicators/dp/B0C7C3WY74/ref=sr_1_6?dib=eyJ2IjoiMSJ9.MHNFOkyqj10Gff_Vww3O46ijIHTK1w8r0CPGIt9JigzrMlKZwmtWBoZqs112iVYpKF8b5PkaLpLs9Lb24Mul_Yr-oWUtbPv4XUQgbEZRfjr4g0sFL-IEv3eZj_-B_eBpsjZt2nhJf017djXDqqU1nagQdoy2H-OctvfWYcnmlXiLciMNE7n5unasS5VcSrGYZ2n1hRoaJhfIqvQsmgd_YqSURzlGOBOvan1CpUEmo0P3wnpXOI8ud6TMPAzECi9XLbDf96zr6-eP4DAGDHY9QeeafxHctQlNly95ZY_CuyI.AkIiRyy-01xoXvLqBVLu4UFGEq1jqsdErPSSpxD6YY4&dib_tag=se&qid=1716059976&refinements=p_72%3A1318476031&rnid=1318475031&s=electronics&sr=1-6,4,630,2999,1099,63,1900,[],Electronics,Mobiles & Accessories,Mobile Accessories,Chargers,Power Banks,,,"['Electronics', 'Mobiles & Accessories', 'Mobile Accessories', 'Chargers', 'Power Banks']","Charges your devices simultaneously with two USB A output ports. Supports 2-way 22.5w (Max) fast charging (Quick Charge 3.0 & Power Delivery charging). The power bank has intelligent input and output controls and LED indicators for a seamless experience. The device offers a world-class built-in 12-layer smart IC protection against short circuits, overcharging, over-discharging, and more! The sleek and durable Aluminum alloy casing offers protection with style. The Pass-Through Simultaneous Charge-Discharge feature allows you to charge your power bud while it charges your devices.",,,,,,,,,,,,,,,,,,,,,,,,,,,,,,,,,,,,
211,Portronics Luxcell Wireless Mini 10k 10000mAh 15W Magnetic Wireless Fast Charging Smallest Power Bank with 22.5 Wired Output Compatible with iPhone 12 & Above & Other QI Enabled Devices(Yellow),https://www.amazon.in/Portronics-Wireless-10000mAh-Magnetic-Compatible/dp/B0CRYK88VX/ref=sr_1_7?dib=eyJ2IjoiMSJ9.MHNFOkyqj10Gff_Vww3O46ijIHTK1w8r0CPGIt9JigzrMlKZwmtWBoZqs112iVYpKF8b5PkaLpLs9Lb24Mul_Yr-oWUtbPv4XUQgbEZRfjr4g0sFL-IEv3eZj_-B_eBpsjZt2nhJf017djXDqqU1nagQdoy2H-OctvfWYcnmlXiLciMNE7n5unasS5VcSrGYZ2n1hRoaJhfIqvQsmgd_YqSURzlGOBOvan1CpUEmo0P3wnpXOI8ud6TMPAzECi9XLbDf96zr6-eP4DAGDHY9QeeafxHctQlNly95ZY_CuyI.AkIiRyy-01xoXvLqBVLu4UFGEq1jqsdErPSSpxD6YY4&dib_tag=se&qid=1716059976&refinements=p_72%3A1318476031&rnid=1318475031&s=electronics&sr=1-7,4,539,3999,1529,62,2470,"['Upto ₹68.87 EMI interest savings on Amazon Pay ICICI Bank Credit CardsUpto ₹68.87 EMI interest savings on Amazon Pay ICICI…', 'Upto ₹2,000.00 discount on select Credit Cards, HDFC Bank Debit CardsUpto ₹2,000.00 discount on select Credit Cards, HDFC…', 'Get GST invoice and save up to 28% on business purchases. Sign up for freeGet GST invoice and save up to 28% on business purchases.']",Electronics,Mobiles & Accessories,Mobile Accessories,Chargers,Power Banks,,,"['Electronics', 'Mobiles & Accessories', 'Mobile Accessories', 'Chargers', 'Power Banks']","MagSafe Wireless Charging: Portronics Luxcell Wireless Mini 10K supports 15W Magsafe (wireless) charging for QI-enabled devices (iPhone- 12 and above, Samsung S series, etc). 22.5W Smallest Power Bank: This smallest 10,000mAh Lithium Polymer battery power bank delivers a rapid 22.5W maximum output, guaranteeing you'll never run out of battery again. Stay charged on the go! Dual Port Fast Charge: This fast charging power bank offers you Fast charging via Type C PD Port and USB MACH port, so you can charge multiple devices at one time. Refuel the power bank via the Type C port. Luxury Charging Solution: Glam up your charging routine with Luxcell Wireless Power Bank, which combines lasting performance with stunning aesthetics. Get a complementary Type C to Type C cable as a bonus! LED Battery Indicator: This 10000 mAh Fast charging Power bank has a transparent plastic casing with an LED indicator, keeping you informed about the power bank and your device’s charge. Broad Compatibility: Luxcell Wireless Mini 10K, PD Power Bank is compatible with smartphones, tablets, earbuds, neckbands, speakers, smartwatches, and other USB-powered devices. It can charge an iPhone 14 battery up to 45% in an hour. Sleek and Compact Body: Its ultra-compact body and fine touch finish give it a premium look. Apart from being powerful, it fits effortlessly into your bag or pocket, making it the ideal travel companion.",,,,,,,,,,,,,,,,,,,,,,,,,,,,,,,,,,,,
212,"Ambrane 10000mAh Slimmest & Compact (Pocket/Bag Friendly) Powerbank, 22.5W Fast Charging, USB & Type C Output, Power Delivery, Quick Charge for iPhone, Android & Other Devices (Powerlit, Black)",https://www.amazon.in/Ambrane-Powerbank-Li-Polymer-Powerlit-Black/dp/B0BYVH465B/ref=sr_1_20?dib=eyJ2IjoiMSJ9.MHNFOkyqj10Gff_Vww3O46ijIHTK1w8r0CPGIt9JigzrMlKZwmtWBoZqs112iVYpKF8b5PkaLpLs9Lb24Mul_Yr-oWUtbPv4XUQgbEZRfjr4g0sFL-IEv3eZj_-B_eBpsjZt2nhJf017djXDqqU1nagQdoy2H-OctvfWYcnmlXiLciMNE7n5unasS5VcSrGYZ2n1hRoaJhfIqvQsmgd_YqSURzlGOBOvan1CpUEmo0P3wnpXOI8ud6TMPAzECi9XLbDf96zr6-eP4DAGDHY9QeeafxHctQlNly95ZY_CuyI.AkIiRyy-01xoXvLqBVLu4UFGEq1jqsdErPSSpxD6YY4&dib_tag=se&qid=1716059976&refinements=p_72%3A1318476031&rnid=1318475031&s=electronics&sr=1-20,4.1,465,1999,1299,35,700,[],Electronics,Mobiles & Accessories,Mobile Accessories,Chargers,Power Banks,,,"['Electronics', 'Mobiles & Accessories', 'Mobile Accessories', 'Chargers', 'Power Banks']","Fast Charging – With charging output of 22.5W, PowerLit can charge your mobile devices (Mi, Realme, Oppo, Vivo, Samsung, OnePlus, iPhone) in lowest possible time. It can charge a 3000 mAh device in 90 minutes Charge Multiple Devices – It has type C port which supports two-way fast charging of 18W for both input and output. It also has USB output of 22.5W, that can charge your devices Easy to Carry – PowerLit is the smallest and lightest 10000mAh powerbank. It’s sleek and compact design completely complements your mobile size, making it very comfortable to carry and use It only takes 4.5 hours with QC Port to get fully charged itself and can charge your devices like Mi A2 – 2.3 times, Realme C2 – 1.7 times, iPhone 8 – 3.8 Times, Oppo F11 Pro – 1.7 times, Samsung M10 – 1.7 times on its full capacity Rugged Metal Body – The outer body of PowerLit is made of high-quality metal that not only gives it a super-premium look but also durability Stylish & Super Compact - The sleek and stylish design of this powerbank makes it a statement piece. Because of its extremely compact size, it can easily fit into your pocket. Safe & Reliable - With its sturdy outer body and multi-layers of advanced chipset protection, this powerbank provides a secure and reliable charging experience.",,,,,,,,,,,,,,,,,,,,,,,,,,,,,,,,,,,,
213,"Duracell 20000 MAH Slimmest Power Bank with 1 Type C PD and 2 USB A Port, 22.5W Fast Charging Portable Charger to Charges 3 Devices Simultaneously for iPhones, Android Phones, Smart Watches & More",https://www.amazon.in/Duracell-Slimmest-Charging-Portable-Simultaneously/dp/B0BJV4L36G/ref=sr_1_5?dib=eyJ2IjoiMSJ9.MHNFOkyqj10Gff_Vww3O46ijIHTK1w8r0CPGIt9JigzrMlKZwmtWBoZqs112iVYpKF8b5PkaLpLs9Lb24Mul_Yr-oWUtbPv4XUQgbEZRfjr4g0sFL-IEv3eZj_-B_eBpsjZt2nhJf017djXDqqU1nagQdoy2H-OctvfWYcnmlXiLciMNE7n5unasS5VcSrGYZ2n1hRoaJhfIqvQsmgd_YqSURzlGOBOvan1CpUEmo0P3wnpXOI8ud6TMPAzECi9XLbDf96zr6-eP4DAGDHY9QeeafxHctQlNly95ZY_CuyI.AkIiRyy-01xoXvLqBVLu4UFGEq1jqsdErPSSpxD6YY4&dib_tag=se&qid=1716059976&refinements=p_72%3A1318476031&rnid=1318475031&s=electronics&sr=1-5,4.2,2180,3499,3099,11,400,"['Upto ₹139.54 EMI interest savings on Amazon Pay ICICI Bank Credit CardsUpto ₹139.54 EMI interest savings on Amazon Pay ICICI…', 'Upto ₹2,000.00 discount on select Credit Cards, HDFC Bank Debit CardsUpto ₹2,000.00 discount on select Credit Cards, HDFC…', 'Get GST invoice and save up to 28% on business purchases. Sign up for freeGet GST invoice and save up to 28% on business purchases.']",Electronics,Mobiles & Accessories,Mobile Accessories,Chargers,Power Banks,,,"['Electronics', 'Mobiles & Accessories', 'Mobile Accessories', 'Chargers', 'Power Banks']","Duracell Power Bank 20000 mAh, Portable Charger, USB C/Micro USB Input, USB A/USB C output, Fast Charge Technology, 22.5W Power Delivery for Smartphones, Tablets, Headphones and USB-Powered Devices",,,,,,,,,,,,,,,,,,,,,,,,,,,,,,,,,,,,
