deal_id,deal_title,deal_url,deal_rating,deal_rating_count,deal_mrp_price,deal_act_price,deal_offer_percent,deal_offer_price,top_offers,category_1,category_2,category_3,category_4,category_5,category_6,category_7,category_all,product_description,top_customer_reviews,Unnamed: 20,Unnamed: 21,Unnamed: 22,Unnamed: 23,Unnamed: 24,Unnamed: 25,Unnamed: 26,Unnamed: 27,Unnamed: 28,Unnamed: 29,Unnamed: 30,Unnamed: 31,Unnamed: 32,Unnamed: 33,Unnamed: 34,Unnamed: 35,Unnamed: 36,Unnamed: 37,Unnamed: 38,Unnamed: 39,Unnamed: 40,Unnamed: 41,Unnamed: 42,Unnamed: 43,Unnamed: 44,Unnamed: 45,Unnamed: 46,Unnamed: 47,Unnamed: 48,Unnamed: 49,Unnamed: 50,Unnamed: 51,Unnamed: 52,Unnamed: 53,Unnamed: 54
10,"Hold up Wireless R1 Bluetooth Selfie Stick  (Black, Remote Included)",https://www.flipkart.com/hold-up-wireless-r1-bluetooth-selfie-stick/p/itmb7da3ce6628f3?pid=SSKGYV32GGHPSJ2R&lid=LSTSSKGYV32GGHPSJ2RPZNTBP&marketplace=FLIPKART&store=tyy&srno=b_1_9&otracker=browse&iid=2aa283c3-0893-41af-a4ff-67eb2050128d.SSKGYV32GGHPSJ2R.SEARCH&ssid=trqyjrmaa80000001715182870897,4,52451,999,199,80,800,"[{'type': 'Bank Offer', 'description': 'Get ₹25 instant discount on first Flipkart UPI txns on order of ₹250 and above'}, {'type': 'Bank Offer', 'description': '5% Cashback on Flipkart Axis Bank Card'}, {'type': 'Bank Offer', 'description': '10% instant discount on SBI Credit Card Transactions, up to ₹1,250 on orders of ₹5,000 and above'}, {'type': 'Special Price', 'description': 'Get at flat ₹199'}]",Mobiles & Accessories,Mobile Accessories,Selfie Sticks,Hold up Selfie Sticks,,,,"['Home', 'Mobiles & Accessories', 'Mobile Accessories', 'Selfie Sticks', 'Hold up Selfie Sticks']",,"[{'rating': '4', 'comment_text': It's really the best product I've ever found on Flipkart. Service is Flipkart is also good. Best quality. Can go for it without any hesitation. I recommend it.READ MORE""}", {'rating': '5', 'comment_text': 'Nice quality nice packing is alsoREAD MORE'}, {'rating': '5', 'comment_text': 'Nice product 👌READ MORE'}, {'rating': '4', 'comment_text': 'Good one... Hopefully it lasts long.READ MORE'}, {'rating': '4'," 'comment_text': ""Super product I like it very much it's is very easy to useREAD MORE""}", {'rating': '3'," 'comment_text': ""product is good but....little bit jerking whenever holding phone ! tip : if your phone is much more weight then i dont recommend it....coz i am using it with my realme x2 pro near about 210 gms.dont expect from stick's tripod function....its just add on in product"," grif is not better ! for beginner its good.... for pro users.....not recommended !READ MORE""}", {'rating': '4', 'comment_text': 'This selfie stick is great: but I bought it for vlogging, the stick is a bit weak for vlogging, but the product is good:...READ MORE'}, {'rating': '5', 'comment_text': 'Super 👌👌👌READ MORE'}, {'rating': '4', 'comment_text': 'If you are looking for a sturdy selfie stick/ tripod then its not for you. Go for higher price range for a strong one. This one fulfils the basic needs. Its not strong enough. For this price range it is goodREAD MORE'}, {'rating': '5'," 'comment_text': 'niceREAD MORE'}]""",,,,,,,,,,,,,,
30,"Flipkart SmartBuy R1 Bluetooth Selfie Stick with Remote, 3-in-1 Multifunctional Selfie Stick, Tripod, Monopod Stand & Mobile Stand Compatible with All Mobile Phones Bluetooth Selfie Stick  (Black, Remote Included)",https://www.flipkart.com/flipkart-smartbuy-r1-bluetooth-selfie-stick-remote-3-in-1-multifunctional-stick-tripod-monopod-stand-mobile-compatible-all-phones/p/itm74548dfd043e7?pid=SSKGSK7RPJJNAAQR&lid=LSTSSKGSK7RPJJNAAQRU04M1E&marketplace=FLIPKART&store=tyy&srno=b_1_40&otracker=browse&iid=2aa283c3-0893-41af-a4ff-67eb2050128d.SSKGSK7RPJJNAAQR.SEARCH&ssid=trqyjrmaa80000001715182870897,4.1,2071,999,199,80,800,"[{'type': 'Bank Offer', 'description': 'Get ₹25 instant discount on first Flipkart UPI txns on order of ₹250 and above'}, {'type': 'Bank Offer', 'description': '5% Cashback on Flipkart Axis Bank Card'}, {'type': 'Bank Offer', 'description': '10% instant discount on SBI Credit Card Transactions, up to ₹1,250 on orders of ₹5,000 and above'}, {'type': 'Special Price', 'description': 'Get at flat ₹199'}]",Mobiles & Accessories,Mobile Accessories,Selfie Sticks,Flipkart SmartBuy Selfie Sticks,,,,"['Home', 'Mobiles & Accessories', 'Mobile Accessories', 'Selfie Sticks', 'Flipkart SmartBuy Selfie Sticks']",,"[{'rating': '5', 'comment_text': 'Nice productREAD MORE'}, {'rating': '5', 'comment_text': 'Very Nice Product 🤩 Super👌🏻READ MORE'}, {'rating': '3', 'comment_text': 'NiceREAD MORE'}, {'rating': '5', 'comment_text': 'So niceREAD MORE'}, {'rating': '5', 'comment_text': 'Good productREAD MORE'}, {'rating': '4', 'comment_text': 'GoodREAD MORE'}, {'rating': '5', 'comment_text': 'Lovely product. I am happy😊READ MORE'}, {'rating': '5', 'comment_text': 'Very nice product for vlogging...🌠READ MORE'}, {'rating': '5', 'comment_text': 'ExcellentREAD MORE'}, {'rating': '5', 'comment_text': 'Very nice productREAD MORE'}]",,,,,,,,,,,,,,,,,,,,,,,,,,,,,,,,,,,
34,"NAFA Bluetooth Selfie Stick  (Black, Remote Included)",https://www.flipkart.com/nafa-bluetooth-selfie-stick/p/itmb43680931eae2?pid=ACCGDYA8FGNHCECY&lid=LSTACCGDYA8FGNHCECYVB4UFU&marketplace=FLIPKART&store=tyy&srno=b_1_11&otracker=browse&iid=en_H8uW_ANY5w9UJ6ZFeQrxwt_OrEfcJ8x9qOghVdgKd6L9uiQz1-3ipLX77500y--NXLmfASQjIlPFH3Ijc5A-aw%3D%3D&ssid=trqyjrmaa80000001715182870897,3.7,2879,1499,299,80,1200,"[{'type': 'Bank Offer', 'description': 'Get ₹25 instant discount on first Flipkart UPI txns on order of ₹250 and above'}, {'type': 'Bank Offer', 'description': '5% Cashback on Flipkart Axis Bank Card'}, {'type': 'Bank Offer', 'description': '10% instant discount on SBI Credit Card Transactions, up to ₹1,250 on orders of ₹5,000 and above'}, {'type': 'Special Price', 'description': 'Get extra 5% off (price inclusive of cashback/coupon)'}]",Mobiles & Accessories,Mobile Accessories,Selfie Sticks,NAFA Selfie Sticks,,,,"['Home', 'Mobiles & Accessories', 'Mobile Accessories', 'Selfie Sticks', 'NAFA Selfie Sticks']",,"[{'rating': '5', 'comment_text': 'Just amazing selfie stick with multiple benefits. It has a tripod base that is perfect for group shots, and a bluetooth remote button that makes it easy to take photos from a distance. And it is lightweight and easy to carry around.READ MORE'}, {'rating': '5', 'comment_text': 'Product is very good for this price. Everything is working fine till now.READ MORE'}, {'rating': '4', 'comment_text': 'Nice 👍👍👍READ MORE'}, {'rating': '5', 'comment_text': 'So beautiful product 🥰Thank you FlipkartREAD MORE'}, {'rating': '5', 'comment_text': 'Nice built and design. light and easy to use selfie and tripod stand.READ MORE'}, {'rating': '1', 'comment_text': 'Very bad plzz dont bu thisREAD MORE'}, {'rating': '5', 'comment_text': 'Quality of product is really vary good.We can easily use and click photos.Using tripod we can take pictures and videos also.Colour is also nice.READ MORE'}, {'rating': '1', 'comment_text': After 1 time use it's loose.READ MORE""}", {'rating': '5'," 'comment_text': ""It's amazing product . I personally like this productREAD MORE""}", {'rating': '3'," 'comment_text': 'Good product 👍READ MORE'}]""",,,,,,,,,,,,,,,,,,,,,,,,,,,,,,,
35,"NAFA Portable Selfie Stick Tripod with Bluetooth Remote, Tripod Stand, Multifunctional Selfie Stick with Extendable Aluminium Monopod, 360 deg Rotation Phone Holder, Adjustable Grip Tripod Bluetooth Selfie Stick  (Black, Remote Included)",https://www.flipkart.com/nafa-portable-selfie-stick-tripod-bluetooth-remote-stand-multifunctional-extendable-aluminium-monopod-360-deg-rotation-phone-holder-adjustable-grip/p/itm2704befebcc6a?pid=SSKGD5852E6HV4BP&lid=LSTSSKGD5852E6HV4BPX4W0MN&marketplace=FLIPKART&store=tyy&srno=b_1_38&otracker=browse&iid=en_H8uW_ANY5w9UJ6ZFeQrxwt_OrEfcJ8x9qOghVdgKd6IQgW58pHwhS7wD2Rs004CixzQT1cbxU99Z1wPUQb2SUw%3D%3D&ssid=trqyjrmaa80000001715182870897,3.8,3788,1299,299,76,1000,"[{'type': 'Bank Offer', 'description': 'Get ₹25 instant discount on first Flipkart UPI txns on order of ₹250 and above'}, {'type': 'Bank Offer', 'description': '5% Cashback on Flipkart Axis Bank Card'}, {'type': 'Bank Offer', 'description': '10% instant discount on SBI Credit Card Transactions, up to ₹1,250 on orders of ₹5,000 and above'}, {'type': 'Special Price', 'description': 'Get extra 40% off (price inclusive of cashback/coupon)'}]",Mobiles & Accessories,Mobile Accessories,Selfie Sticks,NAFA Selfie Sticks,,,,"['Home', 'Mobiles & Accessories', 'Mobile Accessories', 'Selfie Sticks', 'NAFA Selfie Sticks']",,"[{'rating': '5', 'comment_text': 'Nice product at low rangeREAD MORE'}, {'rating': '5', 'comment_text': A very fine and useful selfie stickIt's Blootooth functioning is excellentYou can use it in 3-4 ways It's quality and Body was so goodREAD MORE""}", {'rating': '5', 'comment_text': 'A powerpack selfie stick with remote, length of extension rod is 1.6ft. Working perfectly, battery can be easily replacible.READ MORE'}, {'rating': '5', 'comment_text': 'Best in priceREAD MORE'}, {'rating': '5', 'comment_text': 'THIS IS A MUST HAVEMY WIFE, FAMILY, AND I WENT ON A VACATION AND THOUGHT THIS WOULD BE NICE TO HAVE THAN TO STOP STRANGERS TO TAKE OUR PICTURES. ITS EASY TO SET UP AND USE. CONNECTED TO MY 6SPLUS WITHOUT A PROBLEMREAD MORE'}, {'rating': '5', 'comment_text': 'Good product.READ MORE'}, {'rating': '5'," 'comment_text': ""Great product .. it's durable", totally flexible, mostly the Bluetooth facility, it's awesome," very easy to use.. I am glad I bought it...READ MORE""}", {'rating': '5', 'comment_text': 'GoodREAD MORE'}, {'rating': '3', 'comment_text': 'Nice traipotREAD MORE'}, {'rating': '4'," 'comment_text': 'Nice productREAD MORE'}]""",,,,,,,,,,,
111,"Tygot Bluetooth Extendable Selfie Sticks with Wireless Remote and Tripod Stand, 3-in-1 Multifunctional Selfie Stick with Tripod Stand Compatible with iPhone/OnePlus/Samsung/Oppo/Vivo and All Phones",https://www.amazon.in/Tygot-Bluetooth-Extendable-Multifunctional-Compatible/dp/B094YFFSMY/ref=sr_1_14?dib=eyJ2IjoiMSJ9.f1CDQrdL6WIsNU9QVa9kRWYy_8ida58ZwjDpYvnF4Nzz_egKGxcPZlongZ3KBLrOLv-l7kDsUAnPKaiP8Nt0C5FPxK8Y3OLcBh4aYkWyAiyC9IbeEKR0PbmAiqLrE1GgxKlnI60_aGASULnpfyyufrBy-VLRiUQ5W96IeWoL0klmU_x-f1KQHdttXTtg_O2-1c7Bxeu3xL1DmaecnEdSPY1XWItKSale0yc3MwiS7AIJEEORoQT-dX9wiu7n5wvF7Iq17lZgsqnxTEKzEJamaZajoHB4uqZu4RvkGSF425Q.hnnyAPUjx4ZAhD1LL-0-xcqy-qVhh4IjdyY0nftbTjk&dib_tag=se&qid=1716053411&refinements=p_72%3A1318476031&rnid=1318475031&s=electronics&sr=1-14,4,5713,1999,329,84,1670,[],Electronics,Mobiles & Accessories,Mobile Accessories,Photo & Video Accessories,Selfie Sticks,,,"['Electronics', 'Mobiles & Accessories', 'Mobile Accessories', 'Photo & Video Accessories', 'Selfie Sticks']",This is a Bluetooth Enabled selfie Stick for Mobile Phone. Just click the wireless remote to capture the photo Bluetooth Selfie Stick is provided with a tiny wireless remote that can be connected to your phone and can be used up to about 15 Ft Ultra Light Selfie Stick can be used to Take selfies or capture your favourate videos. This multifunction tripod with selfie stick weighs only 113 Grams.. Rubber Grip : No Tygot Mobile Selfie Stick is compact and foldable. It can be Extended up to 60 Cms long Selfie Stand for Mobile Phone can be Rotated to 360 degree + 220 Degree Angular Adjustment,,,,,,,,,,,,,,,,,,,,,,,,,,,,,,,,,,,,
